<?xml version="1.0" encoding="UTF-8"?>

<routineAdverseEvents xmlns:xsi="http://www.w3.org/2001/XMLSchema-instance"
 xsi:noNamespaceSchemaLocation="routineAeXSD.xsd">
    <routineAdverseEvent>
        <status>CURRENT</status>
        <treatmentAssignment><code>s111</code></treatmentAssignment>
        <assignment>
            <studySite>
                <study><identifiers><identifier><value>0105-L</value></identifier></identifiers> </study>
                <organization><name>Wake Forest Comprehensive Cancer Center</name></organization>
            </studySite>
            <participant><identifiers><identifier><value>ss2233</value></identifier></identifiers></participant>
        </assignment>
        <startDate>2007-06-16</startDate>
        <endDate>2007-07-16</endDate>
        <adverseEvents>
            <adverseEvent>
                <adverseEventCtcTerm><ctcTerm><ctepCode>10040400</ctepCode></ctcTerm></adverseEventCtcTerm>
                <grade>SEVERE</grade>
                <hospitalization>HOSPITALIZATION</hospitalization>
                <expected>false</expected>
                <attributionSummary>POSSIBLE</attributionSummary>
            </adverseEvent>
        </adverseEvents>
        </routineAdverseEvent>
</routineAdverseEvents>
